{
  "model": "VLA-0",
  "paperTitle": "VLA-0: Building State-of-the-Art VLAs with Zero Modification",
  "paperUrl": "https://arxiv.org/abs/2510.13054",
  "arxivId": "2510.13054",
  "publishedAt": "Oct 2025",
  "organization": "NVIDIA",
  "flag": "🇺🇸",
  "benchmarks": [
    {
      "label": "LIBERO",
      "query": "LIBERO",
      "overall": 94.7,
      "detail": "Details: goal 96.2 · long 87.6 · object 97.8 · spatial 97"
    }
  ]
}
