{
  "model": "CronusVLA",
  "paperTitle": "CronusVLA: Towards Efficient and Robust Manipulation via Multi-Frame Vision-Language-Action Modeling",
  "paperUrl": "https://arxiv.org/abs/2506.19816",
  "arxivId": "2506.19816",
  "publishedAt": "Jun 24, 2025",
  "organization": "USTC",
  "flag": "🇨🇳",
  "benchmarks": [
    {
      "label": "LIBERO",
      "query": "LIBERO",
      "overall": 97
    },
    {
      "label": "MIKASA",
      "query": "MIKASA",
      "overall": 18
    },
    {
      "label": "SimplerEnv",
      "query": "SimplerEnv",
      "overall": 70.9,
      "detail": "VM 70.9"
    }
  ]
}
