{
  "model": "π0.5",
  "paperTitle": "RoboCasa365 multi-task learning leaderboard entry",
  "paperUrl": "https://arxiv.org/abs/2603.04356",
  "arxivId": "2603.04356",
  "publishedAt": "Updated Apr 6, 2026",
  "organization": "Physical Intelligence",
  "flag": "🇺🇸",
  "benchmarks": [
    {
      "label": "RoboCasa365",
      "query": "RoboCasa365",
      "overall": 16.9,
      "detail": "Atomic-Seen 39.6 · Composite-Seen 7.1 · Composite-Unseen 1.2"
    }
  ]
}
