{
  "model": "MINT-4B",
  "paperTitle": "Mimic Intent, Not Just Trajectories",
  "paperUrl": "https://arxiv.org/abs/2602.08602",
  "arxivId": "2602.08602",
  "publishedAt": "Feb 2026",
  "organization": "Shanghai Jiao Tong University / Shanghai Innovation Institute",
  "flag": "🇨🇳",
  "benchmarks": [
    {
      "label": "LIBERO",
      "query": "LIBERO",
      "overall": 98.2,
      "detail": "Table I: libero spatial 97.4 · libero object 99.6 · libero goal 98.2 · libero long 97.8 · libero 90 98.7 · overall 98.2."
    },
    {
      "label": "LIBERO-Plus",
      "query": "LIBERO-Plus",
      "overall": 80.1,
      "detail": "Table II: camera 72.2 · robot 42.4 · language 85.8 · light 96.6 · background 88.9 · noise 90.1 · layout 84.6 · overall 80.1."
    }
  ]
}
