{
  "model": "StarVLA-GR00T (Qwen3-VL-4B)",
  "paperTitle": "StarVLA-GR00T (Qwen3-VL-4B) model paper (2604.05014)",
  "paperUrl": "https://arxiv.org/abs/2604.05014",
  "arxivId": "2604.05014",
  "publishedAt": "Apr 2026",
  "organization": "NVIDIA",
  "flag": "🇺🇸",
  "benchmarks": [
    {
      "label": "SimplerEnv",
      "query": "SimplerEnv",
      "overall": 65.3,
      "detail": "Suites: widowx vm 65.3 | Tasks: put spoon on towel vm 83 · put carrot on plate vm 59.4 · stack green block on yellow block vm 18.8 · put eggplant in yellow basket vm 100 | Table 3"
    }
  ]
}
